{
  "$schema": "https://json-schema.org/draft/2020-12/schema",
  "$id": "https://github.com/brullik/brullik-bybit-grid-bot-research/schemas/evidence/v1/phase2-public-history-campaign.schema.json",
  "title": "Sanitized Phase 2 public history Landing campaign evidence",
  "type": "object",
  "additionalProperties": false,
  "required": [
    "bindings",
    "content_sha256",
    "evidence_schema",
    "generated_at_utc",
    "landing",
    "limitations",
    "process",
    "scope",
    "source_policy",
    "status",
    "storage_policy"
  ],
  "properties": {
    "adaptive_throttling": {
      "type": "object",
      "additionalProperties": false,
      "required": [
        "automatic_increase_count",
        "child_job_count",
        "completed_page_response_coverage_complete",
        "complete_header_observation_count",
        "configured_target_rps",
        "cooldown_event_count",
        "header_absent_observation_count",
        "invalid_header_observation_count",
        "low_headroom_event_count",
        "maximum_child_final_effective_rps",
        "maximum_cooldown_ms",
        "minimum_child_effective_rps",
        "minimum_child_final_effective_rps",
        "policy",
        "rate_limit_event_count",
        "rate_reduction_count",
        "response_observation_count",
        "response_observation_classification_complete",
        "transport_attempt_accounting_complete",
        "transport_attempt_count",
        "transport_attempt_without_response_count"
      ],
      "properties": {
        "automatic_increase_count": {"const": 0},
        "child_job_count": {"type": "integer", "minimum": 1, "maximum": 2880},
        "completed_page_response_coverage_complete": {"type": "boolean"},
        "complete_header_observation_count": {"type": "integer", "minimum": 0},
        "configured_target_rps": {"type": "integer", "minimum": 1},
        "cooldown_event_count": {"type": "integer", "minimum": 0},
        "header_absent_observation_count": {"type": "integer", "minimum": 0},
        "invalid_header_observation_count": {"type": "integer", "minimum": 0},
        "low_headroom_event_count": {"type": "integer", "minimum": 0},
        "maximum_child_final_effective_rps": {"type": "integer", "minimum": 1},
        "maximum_cooldown_ms": {"type": "integer", "minimum": 0, "maximum": 600000},
        "minimum_child_effective_rps": {"type": "integer", "minimum": 1},
        "minimum_child_final_effective_rps": {"type": "integer", "minimum": 1},
        "policy": {"const": "bybit-v5-response-header-decrease-only-v1"},
        "rate_limit_event_count": {"type": "integer", "minimum": 0},
        "rate_reduction_count": {"type": "integer", "minimum": 0},
        "response_observation_count": {"type": "integer", "minimum": 0},
        "response_observation_classification_complete": {"const": true},
        "transport_attempt_accounting_complete": {"const": true},
        "transport_attempt_count": {"type": "integer", "minimum": 1},
        "transport_attempt_without_response_count": {"type": "integer", "minimum": 0}
      }
    },
    "bindings": {
      "type": "object",
      "additionalProperties": false,
      "required": [
        "campaign_manifest_sha256",
        "campaign_plan_sha256",
        "campaign_request_sha256",
        "capacity_evidence_sha256",
        "instrument_registry_sha256"
      ],
      "properties": {
        "campaign_manifest_sha256": {"$ref": "#/$defs/sha256"},
        "campaign_plan_sha256": {"$ref": "#/$defs/sha256"},
        "campaign_request_sha256": {"$ref": "#/$defs/sha256"},
        "capacity_evidence_sha256": {"$ref": "#/$defs/sha256"},
        "funding_source_boundary_manifest_sha256": {"$ref": "#/$defs/sha256"},
        "funding_source_terminal_boundary_page_chain_sha256": {"$ref": "#/$defs/sha256"},
        "funding_source_terminal_partition_artifact_sha256": {"$ref": "#/$defs/sha256"},
        "funding_source_terminal_partition_content_sha256": {"$ref": "#/$defs/sha256"},
        "instrument_registry_sha256": {"$ref": "#/$defs/sha256"}
      }
    },
    "content_sha256": {"$ref": "#/$defs/sha256"},
    "evidence_schema": {"const": "grid.phase2-public-history-campaign/v1"},
    "generated_at_utc": {"type": "string", "format": "date-time", "pattern": "Z$"},
    "landing": {
      "type": "object",
      "additionalProperties": false,
      "required": [
        "artifact_bytes",
        "by_kind",
        "http_request_count",
        "job_count",
        "page_count",
        "retry_count",
        "row_count"
      ],
      "properties": {
        "artifact_bytes": {"type": "integer", "minimum": 1},
        "by_kind": {
          "type": "array",
          "minItems": 1,
          "maxItems": 3,
          "items": {"$ref": "#/$defs/kindSummary"}
        },
        "http_request_count": {"type": "integer", "minimum": 1},
        "job_count": {"type": "integer", "minimum": 1, "maximum": 2880},
        "page_count": {"type": "integer", "minimum": 1},
        "retry_count": {"type": "integer", "minimum": 0},
        "row_count": {"type": "integer", "minimum": 1}
      }
    },
    "limitations": {
      "type": "array",
      "minItems": 4,
      "uniqueItems": true,
      "items": {"type": "string", "minLength": 1}
    },
    "process": {
      "type": "object",
      "additionalProperties": false,
      "required": [
        "aggregate_receipt_verified",
        "child_receipts_verified",
        "deterministic_resume_supported",
        "software_identity"
      ],
      "properties": {
        "aggregate_receipt_verified": {"const": true},
        "child_receipts_verified": {"const": true},
        "deterministic_resume_supported": {"const": true},
        "software_identity": {"type": "string", "pattern": "^git:[0-9a-f]{40}$"}
      }
    },
    "scope": {
      "type": "object",
      "additionalProperties": false,
      "required": ["bucket_count", "end_ms", "kind_count", "month_count", "start_ms", "symbol_count"],
      "properties": {
        "bucket_count": {"type": "integer", "minimum": 1, "maximum": 8},
        "end_ms": {"$ref": "#/$defs/minute"},
        "kind_count": {"type": "integer", "minimum": 1, "maximum": 3},
        "month_count": {"type": "integer", "minimum": 1, "maximum": 120},
        "start_ms": {"$ref": "#/$defs/minute"},
        "symbol_count": {"type": "integer", "minimum": 1, "maximum": 700}
      }
    },
    "source_policy": {
      "const": {
        "authentication": "none",
        "base_url": "https://api.bybit.com",
        "funding_endpoint": "/v5/market/funding/history",
        "mark_endpoint": "/v5/market/mark-price-kline",
        "private_endpoints_called": false,
        "tick_rows_requested": false,
        "trade_endpoint": "/v5/market/kline"
      }
    },
    "source_quality": {
      "type": "object",
      "additionalProperties": false,
      "required": [
        "admitted_candle_row_count",
        "candle_job_count",
        "canonical_coverage_complete",
        "policy",
        "quarantine_binding_sha256",
        "quarantined_row_count",
        "reason_counts",
        "source_candle_row_count"
      ],
      "properties": {
        "admitted_candle_row_count": {"type": "integer", "minimum": 0},
        "candle_job_count": {"type": "integer", "minimum": 0, "maximum": 1920},
        "canonical_coverage_complete": {"type": "boolean"},
        "policy": {"const": "exact-source-row-quarantine-v1"},
        "quarantine_binding_sha256": {"$ref": "#/$defs/sha256"},
        "quarantined_row_count": {"type": "integer", "minimum": 0},
        "reason_counts": {"$ref": "#/$defs/quarantineReasonCounts"},
        "source_candle_row_count": {"type": "integer", "minimum": 0}
      }
    },
    "status": {"const": "verified-public-landing-campaign"},
    "storage_policy": {
      "const": {
        "evidence_contains_account_data": false,
        "evidence_contains_market_values": false,
        "evidence_contains_runtime_paths": false,
        "runtime_market_artifacts_committed_to_git": false
      }
    },
    "timing": {
      "type": "object",
      "additionalProperties": false,
      "required": [
        "campaign_completed_at_ms",
        "campaign_elapsed_ms",
        "campaign_started_at_ms",
        "summed_child_elapsed_ms",
        "timed_child_count"
      ],
      "properties": {
        "campaign_completed_at_ms": {"type": "integer", "minimum": 0},
        "campaign_elapsed_ms": {"type": "integer", "minimum": 0},
        "campaign_started_at_ms": {"type": "integer", "minimum": 0},
        "summed_child_elapsed_ms": {"type": "integer", "minimum": 0},
        "timed_child_count": {"type": "integer", "minimum": 1, "maximum": 2880}
      }
    }
  },
  "$defs": {
    "kindSummary": {
      "type": "object",
      "additionalProperties": false,
      "required": ["http_request_count", "job_count", "kind", "page_count", "row_count"],
      "properties": {
        "http_request_count": {"type": "integer", "minimum": 1},
        "job_count": {"type": "integer", "minimum": 1},
        "kind": {"enum": ["trade", "mark", "funding"]},
        "page_count": {"type": "integer", "minimum": 1},
        "row_count": {"type": "integer", "minimum": 0}
      }
    },
    "quarantineReasonCounts": {
      "type": "object",
      "additionalProperties": false,
      "required": ["close_outside_low_high", "low_exceeds_high", "open_outside_low_high"],
      "properties": {
        "close_outside_low_high": {"type": "integer", "minimum": 0},
        "low_exceeds_high": {"type": "integer", "minimum": 0},
        "open_outside_low_high": {"type": "integer", "minimum": 0}
      }
    },
    "minute": {"type": "integer", "minimum": 0, "multipleOf": 60000},
    "sha256": {"type": "string", "pattern": "^[0-9a-f]{64}$"}
  }
}
