{"adaptive_throttling":{"automatic_increase_count":0,"child_job_count":978,"complete_header_observation_count":0,"completed_page_response_coverage_complete":false,"configured_target_rps":15,"cooldown_event_count":2,"header_absent_observation_count":43246,"invalid_header_observation_count":0,"low_headroom_event_count":0,"maximum_child_final_effective_rps":15,"maximum_cooldown_ms":1000,"minimum_child_effective_rps":3,"minimum_child_final_effective_rps":3,"policy":"bybit-v5-response-header-decrease-only-v1","rate_limit_event_count":2,"rate_reduction_count":2,"response_observation_classification_complete":true,"response_observation_count":43246,"transport_attempt_accounting_complete":true,"transport_attempt_count":43424,"transport_attempt_without_response_count":178},"bindings":{"campaign_manifest_sha256":"ae272dff8101577707af5f73785c8243381f7e97b335ffbc232db8b43f3a5379","campaign_plan_sha256":"d7b1eb16ed5e0a44c9749d7d2da7a8675506baf4186c7e75d0ddfc59cbb0343f","campaign_request_sha256":"fa5644cf2bb77d4e448a5d27f8b57e59be9614cf54e068a2915f500b36b3de5c","capacity_evidence_sha256":"2363e5795c108186764f098e572388c6bf61185f77ab342c07e1fc61b2ac46d0","instrument_registry_sha256":"9e78d2db1cebb33d1b1bf328df2dee3ee3ad9f7c3db6b42ae916c9017a0fa733"},"content_sha256":"68c9bd39a38c30f878dc9f1134a33f1c5504cf47eb3d3b8f4b308f4cb8ca2d5d","evidence_schema":"grid.phase2-public-history-campaign/v1","generated_at_utc":"2026-08-14T04:59:19.715697Z","landing":{"artifact_bytes":1994193097,"by_kind":[{"http_request_count":21730,"job_count":489,"kind":"trade","page_count":21664,"row_count":15413885},{"http_request_count":21694,"job_count":489,"kind":"mark","page_count":21664,"row_count":15418523}],"http_request_count":43424,"job_count":978,"page_count":43328,"retry_count":96,"row_count":30832408},"limitations":["This proves retained public Landing responses, not canonical Parquet publication.","Current registry lifecycle intersection is ex-post acquisition scope, not historical point-in-time strategy metadata.","Source return does not independently prove that every venue candle or funding event exists.","Quarantined source rows remain absent from canonical history and block complete coverage until separately reconciled.","This evidence does not accept gaps or cadence changes, close Gate 2, or authorize private/live operations."],"process":{"aggregate_receipt_verified":true,"child_receipts_verified":true,"deterministic_resume_supported":true,"software_identity":"git:ed0530aae5fae75aa5d78f62dffe7ed771cc53b1"},"scope":{"bucket_count":5,"end_ms":1785542340000,"kind_count":2,"month_count":103,"start_ms":1514764800000,"symbol_count":5},"source_policy":{"authentication":"none","base_url":"https://api.bybit.com","funding_endpoint":"/v5/market/funding/history","mark_endpoint":"/v5/market/mark-price-kline","private_endpoints_called":false,"tick_rows_requested":false,"trade_endpoint":"/v5/market/kline"},"source_quality":{"admitted_candle_row_count":30832408,"candle_job_count":978,"canonical_coverage_complete":false,"policy":"exact-source-row-quarantine-v1","quarantine_binding_sha256":"0e73a9937f0e2d2df061e9344d2a6c254dbc813b502af6173219664695c185bf","quarantined_row_count":1,"reason_counts":{"close_outside_low_high":0,"low_exceeds_high":0,"open_outside_low_high":1},"source_candle_row_count":30832409},"status":"verified-public-landing-campaign","storage_policy":{"evidence_contains_account_data":false,"evidence_contains_market_values":false,"evidence_contains_runtime_paths":false,"runtime_market_artifacts_committed_to_git":false},"timing":{"campaign_completed_at_ms":1786682150413,"campaign_elapsed_ms":34778220,"campaign_started_at_ms":1786647372193,"summed_child_elapsed_ms":6053035,"timed_child_count":978}}
