{"adaptive_throttling":{"automatic_increase_count":0,"child_job_count":24,"complete_header_observation_count":0,"completed_page_response_coverage_complete":true,"configured_target_rps":15,"cooldown_event_count":0,"header_absent_observation_count":9600,"invalid_header_observation_count":0,"low_headroom_event_count":0,"maximum_child_final_effective_rps":15,"maximum_cooldown_ms":0,"minimum_child_effective_rps":15,"minimum_child_final_effective_rps":15,"policy":"bybit-v5-response-header-decrease-only-v1","rate_limit_event_count":0,"rate_reduction_count":0,"response_observation_classification_complete":true,"response_observation_count":9600,"transport_attempt_accounting_complete":true,"transport_attempt_count":9621,"transport_attempt_without_response_count":21},"bindings":{"campaign_manifest_sha256":"a87ef79466ea579c847e500d84d84a3681d45f05d74d301f6a685cca6e358033","campaign_plan_sha256":"4657105de047d546551ea3b4efe1d9819101279d1f02a13da5c02900c6ecf259","campaign_request_sha256":"a06ee05fa5aae0d54c02e686e0dac85d2a009253d41562545a95c72b21ca1509","capacity_evidence_sha256":"2363e5795c108186764f098e572388c6bf61185f77ab342c07e1fc61b2ac46d0","instrument_registry_sha256":"9e78d2db1cebb33d1b1bf328df2dee3ee3ad9f7c3db6b42ae916c9017a0fa733"},"content_sha256":"faaaed8cdca7808d0ab6a0a7328b6b0fb9fb62ff0f37b74e67da134cc5bda7f8","evidence_schema":"grid.phase2-public-history-campaign/v1","generated_at_utc":"2026-08-13T16:55:06.469591Z","landing":{"artifact_bytes":591702449,"by_kind":[{"http_request_count":4500,"job_count":8,"kind":"trade","page_count":4500,"row_count":4464000},{"http_request_count":4521,"job_count":8,"kind":"mark","page_count":4500,"row_count":4464000},{"http_request_count":600,"job_count":8,"kind":"funding","page_count":600,"row_count":10466}],"http_request_count":9621,"job_count":24,"page_count":9600,"retry_count":21,"row_count":8938466},"limitations":["This proves retained public Landing responses, not canonical Parquet publication.","Current registry lifecycle intersection is ex-post acquisition scope, not historical point-in-time strategy metadata.","Source return does not independently prove that every venue candle or funding event exists.","This evidence does not accept gaps or cadence changes, close Gate 2, or authorize private/live operations."],"process":{"aggregate_receipt_verified":true,"child_receipts_verified":true,"deterministic_resume_supported":true,"software_identity":"git:580394c4f51c2aeef2a05fd83c90cedb735953b4"},"scope":{"bucket_count":8,"end_ms":1785542340000,"kind_count":3,"month_count":1,"start_ms":1782864000000,"symbol_count":100},"source_policy":{"authentication":"none","base_url":"https://api.bybit.com","funding_endpoint":"/v5/market/funding/history","mark_endpoint":"/v5/market/mark-price-kline","private_endpoints_called":false,"tick_rows_requested":false,"trade_endpoint":"/v5/market/kline"},"status":"verified-public-landing-campaign","storage_policy":{"evidence_contains_account_data":false,"evidence_contains_market_values":false,"evidence_contains_runtime_paths":false,"runtime_market_artifacts_committed_to_git":false},"timing":{"campaign_completed_at_ms":1786639371670,"campaign_elapsed_ms":2643108,"campaign_started_at_ms":1786636728562,"summed_child_elapsed_ms":849023,"timed_child_count":24}}
