{"bindings":{"campaign_manifest_sha256":"cef361cb5eb04cee9f2c645a5281b06f50b050eaaf327c58d170b725f558485a","campaign_plan_sha256":"ab32162397e396975071ee3a64cdc372b58938c3f1865439b9e93501611d8f4e","campaign_request_sha256":"2c93143e6cec6bf402994cb23dac98ff25bffd3b8319e19de029f5ec378fc120","capacity_evidence_sha256":"2363e5795c108186764f098e572388c6bf61185f77ab342c07e1fc61b2ac46d0","instrument_registry_sha256":"a351fd4a28e143b84ca7bc1f3449601f4f07904bd9c0dda1d31a9dfd9e3e3c88"},"content_sha256":"ea2074b1449a1baea1e0eb78697e908aa8f3a34ca180b9c9ed5717072a9e7b5e","evidence_schema":"grid.phase2-public-history-campaign/v1","generated_at_utc":"2026-08-13T11:43:35.269301Z","landing":{"artifact_bytes":693425484,"by_kind":[{"http_request_count":5326,"job_count":24,"kind":"trade","page_count":5325,"row_count":5263200},{"http_request_count":5326,"job_count":24,"kind":"mark","page_count":5325,"row_count":5263200},{"http_request_count":715,"job_count":24,"kind":"funding","page_count":715,"row_count":10965}],"http_request_count":11367,"job_count":72,"page_count":11365,"retry_count":2,"row_count":10537365},"limitations":["This proves retained public Landing responses, not canonical Parquet publication.","Current registry lifecycle intersection is ex-post acquisition scope, not historical point-in-time strategy metadata.","Source return does not independently prove that every venue candle or funding event exists.","This evidence does not accept gaps or cadence changes, close Gate 2, or authorize private/live operations."],"process":{"aggregate_receipt_verified":true,"child_receipts_verified":true,"deterministic_resume_supported":true,"software_identity":"git:2089d77820078b72d1dd5c405b2a91f51d2b9034"},"scope":{"bucket_count":1,"end_ms":1767225540000,"kind_count":3,"month_count":24,"start_ms":1704067200000,"symbol_count":5},"source_policy":{"authentication":"none","base_url":"https://api.bybit.com","funding_endpoint":"/v5/market/funding/history","mark_endpoint":"/v5/market/mark-price-kline","private_endpoints_called":false,"tick_rows_requested":false,"trade_endpoint":"/v5/market/kline"},"status":"verified-public-landing-campaign","storage_policy":{"evidence_contains_account_data":false,"evidence_contains_market_values":false,"evidence_contains_runtime_paths":false,"runtime_market_artifacts_committed_to_git":false}}
